run_date,question_id,question,funnel_stage,engine,brand_cited,brand_position,competitors_cited,sources_cited,sentiment,answer_snippet
2026-07-17,PA01,"What are the most common challenges businesses in the United Kingdom face when it comes to health and beauty retail?",Problem Awareness,Perplexity,N,,"Grocery chains; discounters; marketplaces","Mintel; Retail Economics; Cosmetics Business; Reach; Retail Trust",Neutral,"UK health and beauty retailers are squeezed by cost-of-living-driven value sensitivity, intense multichannel competition, and rising expectations around sustainability, transparency, and personalised customer experience."
2026-07-17,PA08,"What are the risks of getting health and beauty retail wrong in the United Kingdom?",Problem Awareness,Perplexity,N,,"Bodycare; The Body Shop; B&M; Home Bargains; Tesco; Sainsbury's; Morrisons","Not captured",Neutral,"Getting health and beauty retail wrong in the UK exposes a business to financial, operational, regulatory, and brand-trust risks that can turn a profitable category into a value-destructive one."
2026-07-17,SD04,"Who are the leading companies offering health and beauty retail in the United Kingdom?",Solution Discovery,Perplexity,Y,1,"Superdrug; Tesco; Sainsbury's; Asda; Morrisons; Aldi; B&M; Amazon; ASOS; Cult Beauty; Birchbox","Not captured",Positive,"The leading health and beauty retailers in the UK are headed by Boots and Superdrug, with Boots explicitly described as the UK's leading health and beauty retailer."
2026-07-17,VE04,"How reputable is Boots compared to Superdrug?",Vendor Evaluation,Perplexity,Y,1,"Superdrug","Which?; employee-review data; industry commentary",Positive,"Boots is generally seen as the more established, heritage and slightly more premium brand, while Superdrug is viewed as the cheaper, value-focused challenger."
2026-07-17,PD08,"Should I go with Boots, or is one of its competitors a better fit for the United Kingdom?",Purchase Decision,Perplexity,Y,1,"Superdrug; Lloyds Pharmacy; Pharmacy2U; Tesco; Sainsbury's; Morrisons; Aldi; Amazon; Waitrose; Lookfantastic","Not captured",Positive,"Boots is usually the best default fit for broad national coverage and brand strength, but competitors may be better for specific customer groups or use cases."
